{
  "transportVersion": 2,
  "schemaVersion": 1,
  "recordClass": "observation",
  "eventType": "BATTLE_OBSERVATION",
  "sequence": 3,
  "session": 123,
  "run": 1,
  "branch": "transient:123:1",
  "battleID": 1,
  "turnID": 1,
  "phase": 1,
  "frameCounter": 10,
  "buildTag": 456,
  "payloadLength": 40,
  "payload": {
    "observerSide": 1,
    "trainerID": 101,
    "ownActive": {
      "speciesID": 13,
      "hp": 10,
      "maxHP": 20,
      "statusMask": 0,
      "knownMoveIDs": [
        33,
        81
      ],
      "movePP": [
        10,
        10,
        0,
        0
      ]
    },
    "opponentActive": {
      "revealedSpeciesID": 1,
      "publicHPBar": 48,
      "publicHPBarMax": 48,
      "revealedMoveIDs": [
        33
      ]
    },
    "legalActionsComplete": false
  },
  "sequenceGap": 0,
  "streamIncomplete": false,
  "wireHex": "640050493032020001007b0000000100000003000000c801000003004000000000004a44d471010006000300000001000000010001000a0000002800000065000d000a0014000000000021005100000000000a0a000001003000210000000000000000000000"
}
