{
  "transportVersion": 2,
  "schemaVersion": 1,
  "recordClass": "canonical_event",
  "eventType": "TRAINER_DEFEATED",
  "sequence": 5,
  "session": 123,
  "run": 1,
  "branch": "transient:123:1",
  "battleID": 1,
  "turnID": 1,
  "phase": 3,
  "frameCounter": 10,
  "buildTag": 456,
  "payloadLength": 4,
  "payload": {
    "trainerID": 101,
    "previouslyUndefeated": true,
    "outcome": 1
  },
  "sequenceGap": 0,
  "streamIncomplete": false,
  "wireHex": "400050493032020001007b0000000100000005000000c801000003001c0000000000ef2049b6010004000500000001000000010003000a0000000400000065000101"
}
